{
  "schema_version": 1,
  "node_id": "controller-ready-frontier",
  "attempt_id": "controller-ready-frontier-attempt-1",
  "phase": "F",
  "status": "passed",
  "model": "moonshot/kimi-k2.7-code",
  "started_at": "2026-08-03T05:12:00Z",
  "completed_at": "2026-08-03T05:17:25Z",
  "summary": "F-4 Tighten repair: closed the inherited-field acceptance bypass in orchestration exact-field validators. ApprovedWork, approved nodes, PredictedTouchEvidence, and nested overlaps now require every accepted required/optional value to be an own data property (Object.hasOwn). Inherited Object.prototype values are rejected even when they satisfy type and content checks. Normal Object.prototype and null-prototype records continue to be accepted when fields are own. Added hostile inherited Gate-1, top-level evidence, and overlap tests proving rejection with no work persistence, scheduling decisions, or frozen-baseline mutation.",
  "acceptance_criteria_status": [
    {
      "criterion": "Only nodes whose dependencies have passed enter the ready frontier.",
      "status": "met",
      "evidence": [
        "src/domains/orchestration/ready-frontier.ts: computeReadyFrontier unchanged; dependency subset check remains intact",
        "test/orchestration/controller-ready-frontier.test.ts ▶ ready frontier suite passes (5/5)",
        "F-4-orchestration-tests.log: ready frontier suite passes"
      ]
    },
    {
      "criterion": "One deterministic attempt job is emitted per ready node and duplicate delivery is idempotent.",
      "status": "met",
      "evidence": [
        "src/domains/orchestration/dispatch-service.ts: dispatchReadyFrontier unchanged; single attempt/job derivation remains intact",
        "test/orchestration/controller-ready-frontier.test.ts ▶ dispatch service suite passes (3/3)",
        "F-4-orchestration-tests.log: dispatch service suite passes"
      ]
    },
    {
      "criterion": "Pool Worker payloads contain one immutable unit and no DAG topology.",
      "status": "met",
      "evidence": [
        "src/domains/orchestration/index.ts: projectAttemptContract unchanged; topology-free contract projection remains intact",
        "test/orchestration/controller-ready-frontier.test.ts ▶ worker projection and queue schema suites pass",
        "F-4-orchestration-tests.log: worker projection (3/3); queue schema and rehydration (7/7)"
      ]
    },
    {
      "criterion": "State transitions use expected-version checks and invalid transitions are rejected.",
      "status": "met",
      "evidence": [
        "src/domains/orchestration/sqlite-store.ts: transitionNode CAS checks unchanged",
        "test/orchestration/controller-ready-frontier.test.ts ▶ CAS lifecycle and accepted-result recovery suites pass",
        "F-4-orchestration-tests.log: CAS lifecycle (3/3); accepted-result recovery (2/2)"
      ]
    },
    {
      "criterion": "Leases and startup reconciliation recover interrupted dispatch/result windows without silently losing work.",
      "status": "met",
      "evidence": [
        "src/domains/orchestration/sqlite-store.ts: lease generation/token checks unchanged",
        "src/domains/orchestration/reconciliation.ts: reconcile unchanged",
        "test/orchestration/controller-ready-frontier.test.ts ▶ lease commands, lease-fenced result acceptance, and reconciliation suites pass",
        "F-4-orchestration-tests.log: lease commands (6/6); lease-fenced result acceptance (9/9); reconciliation (4/4)"
      ]
    },
    {
      "criterion": "Otherwise-ready nodes are serialized when versioned controller-owned predicted-touch metadata indicates sufficiently confident likely overlap, without rewriting approved semantic dependency edges; unavailable or low-confidence predictions fall back to optimistic concurrency, and the prediction and serialization decision are durably recorded.",
      "status": "met",
      "evidence": [
        "src/domains/orchestration/sqlite-store.ts: validatePredictedTouchEvidence now enforces own-field checks for evidence and overlap fields; scheduling policy and decision recording unchanged",
        "test/orchestration/controller-ready-frontier.test.ts ▶ predicted-touch scheduling suite passes (28/28), including new inherited-field rejection tests and own-field preservation tests",
        "F-4-orchestration-tests.log: predicted-touch scheduling suite passes"
      ]
    }
  ],
  "changed_files": [
    "src/domains/orchestration/sqlite-store.ts",
    "test/orchestration/controller-ready-frontier.test.ts"
  ],
  "commands_run": [
    {
      "command": "node --experimental-strip-types --test test/orchestration/*.test.ts",
      "exit_code": 0,
      "output_artifact": ".tmp/crafts-output/controller-ready-frontier-attempt-1/F-4-orchestration-tests.log"
    },
    {
      "command": "npm run typecheck",
      "exit_code": 0,
      "output_artifact": ".tmp/crafts-output/controller-ready-frontier-attempt-1/F-4-typecheck.log"
    },
    {
      "command": "npm test",
      "exit_code": 0,
      "output_artifact": ".tmp/crafts-output/controller-ready-frontier-attempt-1/F-4-npm-test.log"
    },
    {
      "command": "npm run test:worker",
      "exit_code": 0,
      "output_artifact": ".tmp/crafts-output/controller-ready-frontier-attempt-1/F-4-test-worker.log"
    }
  ],
  "cost": {
    "input_tokens": 0,
    "output_tokens": 0,
    "amount": null,
    "currency": null
  },
  "risks": [
    "none"
  ],
  "open_questions": [],
  "recommended_next_step": "Tighten review (T-4) to confirm the inherited-field acceptance bypass is fully closed.",
  "failure_context": null,
  "transcript_path": null,
  "phase_data": {
    "findings_addressed": [
      "exact-field validators for ApprovedWork, approved nodes, PredictedTouchEvidence, and nested overlaps could implicitly accept inherited Object.prototype values (e.g., via prototype pollution) instead of requiring own data properties"
    ],
    "documented_disagreements": [],
    "green_evidence": {
      "commit_sha": "c8e9d853e6a1d89353d0b99592f908d182a24fe4",
      "suite_path": "test/orchestration/controller-ready-frontier.test.ts",
      "suite_hash": "88281473b4e18afcc0c0b5ad81cf1fba3c29ec68cf476f9189e834385947b3b6",
      "command": "node --experimental-strip-types --test test/orchestration/*.test.ts",
      "exit_code": 0,
      "image_digest": "host/node-local",
      "output_artifact": ".tmp/crafts-output/controller-ready-frontier-attempt-1/F-4-orchestration-tests.log"
    },
    "patch_path": null
  }
}
